{
  "schema_version": "2.0",
  "contract_version": "v2",
  "work_order_id": "WO-20260302-01",
  "idempotency_key": "WO-20260302-01",
  "author": "ops-bot",
  "evidence_refs": [
    "PRD/PRD-MASTER.md"
  ],
  "command_id": "WO-20260302-01",
  "challenge": {
    "challenge_id": "not-required",
    "status": "NOT_REQUIRED",
    "expires_at": null
  },
  "occurred_at": "2026-03-02T12:00:00Z",
  "payload_digest": "f1d7f9904eeb60cfd6a6e2f43fe8ca15db7f8eec3f43b13b223c5f9384f7cf43",
  "objective": "Validate governance gates",
  "status": "IN_PROGRESS"
}
